{
  "schema_version": 1,
  "session_id": "persistence-agent-continuity-v1--20261002T022800Z--5d9a31",
  "agent_id": "persistence-agent-continuity-v1",
  "kind": "chat",
  "status": "active",
  "started_at": "2026-10-02T02:28:00Z",
  "parent_session_id": "persistence-agent-continuity-v1--20261001T155500Z--b72e41",
  "continued_from": [
    "persistence-agent-continuity-v1--20261001T155500Z--b72e41"
  ],
  "scope": "standalone",
  "project_id": null,
  "summary": "Started standalone chat session. User asks for a high-level explanation of the major areas within IT.",
  "last_seen_at": "2026-10-02T02:28:00Z"
}
