{
  "schema_version": 1,
  "session_id": "persistence-agent-continuity-v1--20261031T013659Z--f49c21",
  "agent_id": "persistence-agent-continuity-v1",
  "kind": "chat",
  "scope": "standalone",
  "project_id": null,
  "status": "closed",
  "started_at": "2026-10-31T01:36:59Z",
  "parent_session_id": "persistence-agent-continuity-v1--20261031T012326Z--a6d29c",
  "continued_from": [
    "persistence-agent-continuity-v1--20261031T012326Z--a6d29c"
  ],
  "summary": "Official university experimental training centre lists flower seedlings (tulip, lily, camellia, gerbera) and contact Vu Xuan Hai 0979 062 059 at https://evt.vnua.edu.vn/?product_cat=hoa-cay-canh . Hydrangea availability and current stock unverified; contact before travel. No follow-up task queued.",
  "last_seen_at": "2026-10-31T01:36:59Z"
}