{
  "schema_version": 1,
  "session_id": "persistence-agent-continuity-v1--20261019T080716Z--sgfe26",
  "agent_id": "persistence-agent-continuity-v1",
  "kind": "chat",
  "status": "active",
  "started_at": "2026-10-19T08:07:16.250Z",
  "parent_session_id": null,
  "continued_from": [],
  "scope": "standalone",
  "project_id": null,
  "summary": "Chuẩn bị bộ câu hỏi và trả lời phỏng vấn Frontend React, Next.js, React Native cho các bối cảnh sản phẩm Sun Group; tập trung Middle/Senior, không giả định hệ thống nội bộ.",
  "last_seen_at": "2026-10-19T08:07:16.250Z"
}