{
  "schema_version": 1,
  "session_id": "persistence-agent-continuity-v1--20260928T034600Z--9d2a61",
  "agent_id": "persistence-agent-continuity-v1",
  "kind": "chat",
  "status": "active",
  "started_at": "2026-09-28T03:46:00Z",
  "parent_session_id": "persistence-agent-continuity-v1--20260919T144100Z--f8c2d4",
  "continued_from": [
    "persistence-agent-continuity-v1--20260926T153000Z--7b4e21"
  ],
  "summary": "Interactive owner session. Current task: help draft a concise professional email for submitting a CV to apply for a ReactJS Developer role. Career context includes Senior Frontend/React/TypeScript and enterprise fintech experience; avoid overstating claims.",
  "last_seen_at": "2026-09-28T03:46:00Z"
}
