{
  "schema_version": 1,
  "session_id": "persistence-agent-continuity-v1--20260928T151212Z--68d09e",
  "agent_id": "persistence-agent-continuity-v1",
  "kind": "chat",
  "status": "closed",
  "started_at": "2026-09-28T15:12:12.695Z",
  "parent_session_id": null,
  "continued_from": [],
  "summary": "Translated a local image read error into Vietnamese; no durable task state.",
  "last_seen_at": "2026-09-28T15:12:12.695Z"
}
