{
  "schema_version": 1,
  "session_id": "persistence-agent-continuity-v1--20260925T012100Z--c4a7e2",
  "agent_id": "persistence-agent-continuity-v1",
  "kind": "chat",
  "status": "active",
  "started_at": "2026-09-25T01:21:00Z",
  "parent_session_id": "persistence-agent-continuity-v1--20260919T144100Z--f8c2d4",
  "continued_from": ["persistence-agent-continuity-v1--20260919T144100Z--f8c2d4"],
  "summary": "Interactive session continuing the owner's Next.js learning project; current request asks for CLI commands to scaffold a Next.js project with Zustand and TanStack Query and supporting libraries.",
  "last_seen_at": "2026-09-25T01:21:00Z"
}
