{
  "schema_version": 1,
  "session_id": "persistence-agent-continuity-v1--20261021T180127Z--98a547",
  "agent_id": "persistence-agent-continuity-v1",
  "kind": "chat",
  "status": "handoff",
  "started_at": "2026-10-21T18:01:27.707Z",
  "parent_session_id": "persistence-agent-continuity-v1--20261021T173321Z--9d6b2b",
  "continued_from": [
    "persistence-agent-continuity-v1--20261021T173321Z--9d6b2b"
  ],
  "scope": "project",
  "project_id": "robotis-lab",
  "summary": "Owner authorized autonomous hourly GitHub/Webots simulation-only iteration through 2026-10-23 07:00 ICT. Enabled automation Robotis Lab Overnight Development 02:00 Oct22 hourly through 07:00 Oct23. Reviewed native disturbance pilot artifact run 39648900940: 7 force steps at 0.10N pulse 0.112s on pitch+, baseline peak tilt 0.00011rad vs PID 0.00014rad, both INCONCLUSIVE under excitation threshold 0.008; no FAULT. Merged safe docs PR#3 and experimental CI pilot PR#4, both checked; master PR#4 merge sha 99b2444dca784c4198c4dd98003d4b8b04cfa693. Canonical morning note docs/OPERATOR_HANDOFF.md on master. Next automated cycle: calibrate measurable bounded disturbance with real Webots, then matched pitch/roll ± pairs. P3 gait blocked until P2 acceptance; no hardware/servo work.",
  "last_seen_at": "2026-10-21T18:06:13.320Z"
}
