{
  "schema_version": 1,
  "session_id": "persistence-agent-continuity-v1--20260930T025832Z--7c8e42",
  "agent_id": "persistence-agent-continuity-v1",
  "kind": "chat",
  "status": "closed",
  "started_at": "2026-09-30T02:58:32.058Z",
  "parent_session_id": null,
  "continued_from": [],
  "summary": "Owner specified 42 lessons from 2026-09-28, Monday/Wednesday/Friday 21:30–22:25 Vietnam time. First lesson completed; three existing detailed events retained. Added remaining 38 as recurring series ap0l06po424vuvj0qjp8bf0mds from 2026-10-07, weekly MO/WE/FR COUNT=38, 30-minute popup reminders. Calendar search verified all 41 upcoming dates through 2027-01-01. This is a fixed schedule; no automatic Kyna synchronization configured.",
  "last_seen_at": "2026-09-30T02:58:32.058Z"
}