{
  "schema_version": 1,
  "session_id": "persistence-agent-continuity-v1--20260923T080400Z--7c4a21",
  "agent_id": "persistence-agent-continuity-v1",
  "kind": "chat",
  "status": "active",
  "started_at": "2026-09-23T08:04:00Z",
  "parent_session_id": "persistence-agent-continuity-v1--20260919T144100Z--f8c2d4",
  "continued_from": [
    "persistence-agent-continuity-v1--20260919T144100Z--f8c2d4"
  ],
  "summary": "Interactive frontend interview discussion. Current focus: React search-request race conditions caused by out-of-order async responses; explain root cause, fixes, and trade-offs concisely in Vietnamese.",
  "last_seen_at": "2026-09-23T08:04:00Z"
}
