{
  "schema_version": 1,
  "session_id": "persistence-agent-continuity-v1--20261022T030347Z--d25a22",
  "agent_id": "persistence-agent-continuity-v1",
  "kind": "chat",
  "status": "handoff",
  "started_at": "2026-10-22T03:03:47.521Z",
  "parent_session_id": "persistence-agent-continuity-v1--20260919T144100Z--f8c2d4",
  "continued_from": [
    "persistence-agent-continuity-v1--20260919T144100Z--f8c2d4"
  ],
  "scope": "standalone",
  "project_id": null,
  "summary": "Created portable Agent Skill robotis-lab-webots-simulation-engineer with SKILL.md, phase-gate guidance, repository-map checkpoint, test/evidence protocol and reusable task-report template (local ZIP artifact, not committed into robotis-lab). Audited namnx-vn/robotis-lab README and AGENTS/ROADMAP/implementation plan: documented P2 undisturbed native standing but P2 disturbance recovery still unverified; P3 gait blocked. No Webots execution or robotis-lab source changes. Ask owner which primary on-invocation mode/installation target is preferred before any repo deployment.",
  "last_seen_at": "2026-10-22T03:03:47.521Z"
}
