{
  "schema_version": 1,
  "session_id": "persistence-agent-continuity-v1--20260923T132200Z--a8c3f1",
  "agent_id": "persistence-agent-continuity-v1",
  "kind": "chat",
  "status": "active",
  "started_at": "2026-09-23T13:22:00Z",
  "parent_session_id": "persistence-agent-continuity-v1--20260919T144100Z--f8c2d4",
  "continued_from": [
    "persistence-agent-continuity-v1--20260919T144100Z--f8c2d4"
  ],
  "summary": "Interactive interview-preparation session. Owner asks for a concise, credible response about prior banking projects and CRM understanding; use the canonical professional/banking context without overstating direct CRM experience.",
  "last_seen_at": "2026-09-23T13:22:00Z"
}
