{
  "schema_version": 1,
  "session_id": "persistence-agent-continuity-v1--20261022T062420Z--60769a",
  "agent_id": "persistence-agent-continuity-v1",
  "kind": "chat",
  "status": "active",
  "started_at": "2026-10-22T06:24:20.820Z",
  "parent_session_id": null,
  "continued_from": [],
  "scope": "standalone",
  "project_id": null,
  "summary": "Project Art: user requests Halloween preschool coloring illustration(s), A5 portrait, thick black outlines, simple cheerful age 4 themes; produce image generation result.",
  "last_seen_at": "2026-10-22T06:24:20.820Z"
}
